{
  "$id": "urn:x2n:stage-6-assurance-002-state:1.0",
  "$schema": "https://json-schema.org/draft/2020-12/schema",
  "additionalProperties": false,
  "properties": {
    "acceptance_status": {"type": "object"},
    "execution": {"type": "object"},
    "feature_gates": {"type": "object"},
    "next_task": {"type": "object"},
    "phase": {"const": "PH.X2N.6.2"},
    "private_gold": {"type": "object"},
    "project": {"const": "x2n"},
    "release_policy": {"type": "object"},
    "run_id": {"const": "RUN-X2N-S06-A002"},
    "schema_version": {"const": "1.0"},
    "stage": {"const": "STG.X2N.6"},
    "status": {"const": "PASS_CI_SYNTH_MODEL_ASSURANCE_FEATURES_DISABLED_PRIVATE_GOLD_NOT_RUN"},
    "task_base_commit": {"type": "string", "pattern": "^[0-9a-f]{40}$"},
    "task_id": {"const": "TSK.x2n.assurance.002"}
  },
  "required": [
    "acceptance_status",
    "execution",
    "feature_gates",
    "next_task",
    "phase",
    "private_gold",
    "project",
    "release_policy",
    "run_id",
    "schema_version",
    "stage",
    "status",
    "task_base_commit",
    "task_id"
  ],
  "type": "object"
}
