{
  "schema_version": "1.0",
  "project": "x2n",
  "stage": "STG.X2N.6",
  "task_id": "TSK.x2n.assurance.002",
  "phase": "PH.X2N.6.2",
  "run_id": "RUN-X2N-S06-A002",
  "task_base_commit": "bc9bd26d425bcee524981d74fa89d2315d966ec8",
  "status": "PASS_CI_SYNTH_MODEL_ASSURANCE_FEATURES_DISABLED_PRIVATE_GOLD_NOT_RUN",
  "acceptance_status": {
    "ACC.x2n.ai.001": "PASS_CI_SYNTH_FEATURE_GATE_ASR_DISABLED_PRIVATE_GOLD_NOT_RUN",
    "ACC.x2n.ai.002": "PASS_CI_SYNTH_FEATURE_GATE_OCR_DISABLED_PRIVATE_GOLD_NOT_RUN",
    "ACC.x2n.ai.003": "PASS_CI_SYNTH_FEATURE_GATE_VISION_DISABLED_PRIVATE_GOLD_NOT_RUN",
    "ACC.x2n.ai.004": "PASS_CI_SYNTH_FUSION_RED_TEAM_SCHEMA_ISOLATION_MODEL_NOT_RUN",
    "ACC.x2n.ai.005": "PASS_CI_SYNTH_OWNER_TAXONOMY_GUARD_SUGGESTION_ONLY",
    "ACC.x2n.ai.006": "PASS_CI_SYNTH_FEATURE_GATE_CLASSIFICATION_SUGGESTION_ONLY_PRIVATE_GOLD_NOT_RUN",
    "ACC.x2n.ai.007": "PASS_CI_SYNTH_PROVENANCE_CACHE_BUDGET_CLOUD_ZERO",
    "ACC.x2n.rel.002": "PASS_CI_SYNTH_MODEL_PIPELINE_FEATURES_DISABLED_PRIVATE_GOLD_NOT_RUN"
  },
  "execution": {
    "cloud_uploads": 0,
    "config_writes": 0,
    "model_calls": 0,
    "network_calls": 0,
    "platform_calls": 0,
    "private_gold_evaluation": "NOT_RUN",
    "real_account_execution": "NOT_RUN",
    "secret_reads": 0,
    "tool_calls": 0
  },
  "feature_gates": {
    "asr": "DISABLED_PENDING_PRIVATE_GOLD",
    "automatic_classification": "DISABLED_PENDING_ACC.x2n.ai.006",
    "classification": "SUGGESTION_ONLY_PENDING_PRIVATE_GOLD",
    "fusion": "DISABLED_MODEL_NOT_RUN",
    "ocr": "DISABLED_PENDING_PRIVATE_GOLD",
    "vision": "DISABLED_PENDING_PRIVATE_GOLD"
  },
  "private_gold": {
    "accessed": false,
    "quality_claim": "NONE",
    "status": "NOT_RUN_BY_CI_SYNTH"
  },
  "next_task": {
    "id": "TSK.x2n.assurance.003",
    "phase": "PH.X2N.6.3",
    "status": "PLANNED"
  },
  "release_policy": {
    "alpha_beta": "PROHIBITED",
    "direct_mvp_deploy_run_online_smoke": "TSK.x2n.assurance.005_ONLY",
    "fixed_health_observation": "PROHIBITED",
    "fixed_soak": "PROHIBITED"
  }
}
